{
  "attributes": {
    "deployment_role": "standby"
  },
  "cross_environment": false,
  "cross_provider": false,
  "environment_id": "01a0c450-6c0f-7b86-8a9f-6696486b056d",
  "expires_at": null,
  "lifecycle": "active",
  "org_id": "01a0c450-6c01-76c4-8c39-8171fd4953d6",
  "record_state": "present",
  "relationship_id": "01a0c450-7057-7ac3-a499-2b510971369a",
  "revision_from": 1,
  "revision_to": null,
  "shared_endpoint": false,
  "taxonomy_version": "1.0.0",
  "trust_state": "discovered",
  "verification_state": "unverified",
  "verified_at": null,
  "verified_by": null
}
