{
  "attributes": {},
  "cross_environment": true,
  "cross_provider": false,
  "environment_id": null,
  "expires_at": "2027-03-20T10:00:00Z",
  "lifecycle": "active",
  "org_id": "01a0c450-6c01-76c4-8c39-8171fd4953d6",
  "record_state": "present",
  "relationship_id": "01a0c450-718c-7d7c-b486-32c3061f339c",
  "revision_from": 1,
  "revision_to": null,
  "shared_endpoint": false,
  "taxonomy_version": "1.0.0",
  "trust_state": "discovered",
  "verification_state": "verified",
  "verified_at": "2026-09-20T10:00:00Z",
  "verified_by": {
    "key": "https://login.example.invalid/synthetic|steward-0001",
    "namespace": "oidc"
  }
}
